task=#  CREATE TABLE student (
task(# id BIGSERIAL NOT NULL PRIMARY KEY,
task(#  first_name VARCHAR(50) NOT NULL,
task(# last_name VARCHAR(50) NOT NULL,
task(#  gender VARCHAR(50) NOT NULL,
task(#  dob DATE NOT NULL,
task(# email VARCHAR(40) );
CREATE TABLE
task=# \D
invalid command \D
Try \? for help.
task=# \d
               List of relations
 Schema |      Name      |   Type   |  Owner
--------+----------------+----------+----------
 public | student        | table    | postgres
 public | student_id_seq | sequence | postgres
(2 rows)

postgres=# \c task
You are now connected to database "task" as user "postgres".
task=# \dt
          List of relations
 Schema |  Name   | Type  |  Owner
--------+---------+-------+----------
 public | student | table | postgres
(1 row)


task=# select * from students
task-# select *from student;
ERROR:  syntax error at or near "select"
LINE 2: select *from student;
        ^
task=# select *from students;
ERROR:  relation "students" does not exist
LINE 1: select *from students;
                     ^
task=# \d students
Did not find any relation named "students".
task=# \d student
                                     Table "public.student"
   Column   |         Type          | Collation | Nullable |               Default
------------+-----------------------+-----------+----------+-------------------------------------
 id         | bigint                |           | not null | nextval('student_id_seq'::regclass)
 first_name | character varying(50) |           | not null |
 last_name  | character varying(50) |           | not null |
 gender     | character varying(50) |           | not null |
 dob        | date                  |           | not null |
 email      | character varying(40) |           |          |
Indexes:
    "student_pkey" PRIMARY KEY, btree (id)


task=# select *from student;
 id | first_name | last_name | gender |    dob     |      email
----+------------+-----------+--------+------------+-----------------
  1 | Sahil      | Singh     | MALE   | 2001-06-20 | sahil@atcs.com
  2 | Vicky      | Khan      | MALE   | 2002-07-29 | bansal@atcs.com
(2 rows)


task=# ALTER TABLE student ADD COLUMN rollno INT;
ALTER TABLE
task=# \d student;
                                     Table "public.student"
   Column   |         Type          | Collation | Nullable |               Default
------------+-----------------------+-----------+----------+-------------------------------------
 id         | bigint                |           | not null | nextval('student_id_seq'::regclass)
 first_name | character varying(50) |           | not null |
 last_name  | character varying(50) |           | not null |
 gender     | character varying(50) |           | not null |
 dob        | date                  |           | not null |
 email      | character varying(40) |           |          |
 rollno     | integer               |           |          |
Indexes:
    "student_pkey" PRIMARY KEY, btree (id)


task=# ALTER TABLE student RENAME COLUMN gender to sex;
ALTER TABLE
task=# \d student;
                                     Table "public.student"
   Column   |         Type          | Collation | Nullable |               Default
------------+-----------------------+-----------+----------+-------------------------------------
 id         | bigint                |           | not null | nextval('student_id_seq'::regclass)
 first_name | character varying(50) |           | not null |
 last_name  | character varying(50) |           | not null |
 sex        | character varying(50) |           | not null |
 dob        | date                  |           | not null |
 email      | character varying(40) |           |          |
 rollno     | integer               |           |          |
Indexes:
    "student_pkey" PRIMARY KEY, btree (id)


task=# ALTER TABLE student ALTER COLUMN sadd type VARCHAR(15);
ERROR:  column "sadd" of relation "student" does not exist
task=# ALTER TABLE student ALTER COLUMN sadd type VARCHAR(15);
ERROR:  column "sadd" of relation "student" does not exist
task=# \d student;
                                     Table "public.student"
   Column   |         Type          | Collation | Nullable |               Default
------------+-----------------------+-----------+----------+-------------------------------------
 id         | bigint                |           | not null | nextval('student_id_seq'::regclass)
 first_name | character varying(50) |           | not null |
 last_name  | character varying(50) |           | not null |
 sex        | character varying(50) |           | not null |
 dob        | date                  |           | not null |
 email      | character varying(40) |           |          |
 rollno     | integer               |           |          |
Indexes:
    "student_pkey" PRIMARY KEY, btree (id)


task=# ALTER TABLE student DROP COLUMN rollno;
ALTER TABLE
task=# INSERT INTO student VALUES('123','Rivanshu','Bansal','male','2001-01-10','bansal@atcs.com');
INSERT 0 1
task=# SELECT *FROM student;
 id  | first_name | last_name | sex  |    dob     |      email
-----+------------+-----------+------+------------+-----------------
   1 | Sahil      | Singh     | MALE | 2001-06-20 | sahil@atcs.com
   2 | Vicky      | Khan      | MALE | 2002-07-29 | bansal@atcs.com
 123 | Rivanshu   | Bansal    | male | 2001-01-10 | bansal@atcs.com
(3 rows)


task=# UPDATE student SET id=3 WHERE first_name='Rivanshu';
UPDATE 1
task=# SELECT *FROM student;
 id | first_name | last_name | sex  |    dob     |      email
----+------------+-----------+------+------------+-----------------
  1 | Sahil      | Singh     | MALE | 2001-06-20 | sahil@atcs.com
  2 | Vicky      | Khan      | MALE | 2002-07-29 | bansal@atcs.com
  3 | Rivanshu   | Bansal    | male | 2001-01-10 | bansal@atcs.com
(3 rows)


task=#
**********************************Equi JOIN********************************
task=# CREATE TABLE manager(emp_id INT PRIMARY KEY, mgr_name VARCHAR(50),mgr_city VARCHAR(50));
CREATE TABLE
task=# INSERT INTO manager VALUES('100','singh','jaipur');
INSERT 0 1
task=# INSERT INTO manager VALUES('111','kanav','srinagar');
INSERT 0 1
task=# INSERT INTO manager VALUES('112','khandelwal','nagar');
INSERT 0 1
task=# select *from manager;
 emp_id |  mgr_name  | mgr_city
--------+------------+----------
    100 | singh      | jaipur
    111 | kanav      | srinagar
    112 | khandelwal | nagar
(3 rows)


task=# SELECT employee.emp_name,employee.emp_id,manager.emp_id FROM employee,manager WHERE employee.emp_id=manager.emp_id;
 emp_name | emp_id | emp_id
----------+--------+--------
 sahil    |    100 |    100
(1 row)


task=# SELECT *FROM employee;
 emp_id | emp_name | emp_city | esal
--------+----------+----------+-------
    100 | sahil    | jammu    | 10000
    101 | vicky    | jammu    | 20000
    103 | rahul    | delhi    | 30000
    104 | manoj    | jammu    | 40000
(4 rows)


task=# SELECT *FROM manager;
 emp_id |  mgr_name  | mgr_city
--------+------------+----------
    100 | singh      | jaipur
    111 | kanav      | srinagar
    112 | khandelwal | nagar
(3 rows)


task=# SELECT employee.emp_name,employee.emp_id,manager.emp_id FROM employee,manager WHERE employee.emp_city=manager.mgr_city;
 emp_name | emp_id | emp_id
----------+--------+--------
(0 rows)


task=#

